[
  {
    "projectNo": 1,
    "projectName": "To-Do List",
    "projectType": "Tool",
    "projectDesc": "Manage daily tasks efficiently with an interactive checklist system. Add, track and organize activities using a simple productivity-focused interface.",
    "techStack": ["javascript", "todo"],
    "difficulty": "beginner",
    "projectPath": "./public/TO_DO_LIST/todolist.html"
  },
  {
    "projectNo": 2,
    "projectName": "Digital Clock",
    "projectType": "Tool",
    "projectDesc": "Real-time digital clock displaying current time updates instantly. A beginner-friendly project exploring JavaScript timing functions.",
    "techStack": ["javascript"],
    "difficulty": "beginner",
    "projectPath": "./public/digital_clock/digitalclock.html"
  },
  {
    "projectNo": 3,
    "projectName": "Indian Flag",
    "projectType": "UI",
    "projectDesc": "CSS recreation of the Indian national flag using shapes and positioning.",
    "techStack": ["css"],
    "difficulty": "beginner",
    "projectPath": "./public/indianflag/flag.html"
  },
  {
    "projectNo": 4,
    "projectName": "Dropdown Nav Bar",
    "projectType": "UI",
    "projectDesc": "Responsive navigation bar with expandable dropdown interactions.",
    "techStack": ["css"],
    "difficulty": "beginner",
    "projectPath": "./public/dropdown_navbar/index.html"
  },
  {
    "projectNo": 5,
    "projectName": "Animated Cursor",
    "projectType": "UI",
    "projectDesc": "Custom cursor animation adding engaging movement effects across the page.",
    "techStack": ["ui", "javascript", "css"],
    "difficulty": "beginner",
    "projectPath": "./public/Animated-cursor/animated-cursor.html"
  },
  {
    "projectNo": 6,
    "projectName": "Auto Background Image Slider",
    "projectType": "UI",
    "projectDesc": "Automatically rotating image slider with smooth transitions.",
    "techStack": ["javascript"],
    "difficulty": "beginner",
    "projectPath": "./public/Background-Image-sider/slider.html"
  },
  {
    "projectNo": 7,
    "projectName": "Typewriter",
    "projectType": "UI",
    "projectDesc": "Typing animation effect simulating text being written live.",
    "techStack": ["html", "css", "javascript"],
    "difficulty": "advanced",
    "projectPath": "./public/typewriter/typewriter.html"
  },
  {
    "projectNo": 8,
    "projectName": "Parallel-X Website",
    "projectType": "Website",
    "projectDesc": "Parallax-inspired website showcasing layered scrolling effects.",
    "techStack": ["css"],
    "difficulty": "intermediate",
    "projectPath": "./public/Parallel-x%20website/parallal.html"
  },
  {
    "projectNo": 9,
    "projectName": "Captcha Generator",
    "projectType": "Tool",
    "projectDesc": "Generates random captcha strings for validation practice.",
    "techStack": ["javascript"],
    "difficulty": "intermediate",
    "projectPath": "./public/captcha/captcha.html"
  },
  {
    "projectNo": 10,
    "projectName": "QR Code Generator",
    "projectType": "Tool",
    "projectDesc": "Converts text or links into downloadable QR codes instantly.",
    "techStack": ["api", "javascript"],
    "difficulty": "intermediate",
    "projectPath": "./public/qr%20generator/qr.html"
  },
  {
    "projectNo": 11,
    "projectName": "Serve Website Using Express",
    "projectType": "Backend",
    "projectDesc": "Basic Express server setup for hosting web applications.",
    "techStack": ["javascript"],
    "difficulty": "intermediate",
    "projectPath": "./public/Express%20Server/public/index.html"
  },
  {
    "projectNo": 12,
    "projectName": "Nodemailer Contact Form",
    "projectType": "Form",
    "projectDesc": "Email contact form capable of sending messages directly.",
    "techStack": ["api", "javascript"],
    "difficulty": "intermediate",
    "projectPath": "./public/gmail_nodemailer/public/mail.html"
  },
  {
    "projectNo": 13,
    "projectName": "Login Form Using MERN",
    "projectType": "Authentication",
    "projectDesc": "Authentication workflow using MongoDB, Express, React and Node.",
    "techStack": ["api", "javascript", "source-only"],
    "difficulty": "intermediate",
    "projectPath": "https://github.com/dhairyagothi/100_days_100_web_project/tree/Main/public/loginusingmern"
  },
  {
    "projectNo": 14,
    "projectName": "File Uploader",
    "projectType": "Tool",
    "projectDesc": "Upload and manage files through a simple interface.",
    "techStack": ["javascript"],
    "difficulty": "intermediate",
    "projectPath": "./public/file_uploader/public/file_uploader.html"
  },
  {
    "projectNo": 15,
    "projectName": "Progress Bar",
    "projectType": "UI",
    "projectDesc": "Animated progress indicator tracking completion visually.",
    "techStack": ["ui", "css", "javascript"],
    "difficulty": "beginner",
    "projectPath": "./public/progress_bar/progress_bar.html"
  },
  {
    "projectNo": 16,
    "projectName": "Scroll Bar CSS",
    "projectType": "UI",
    "projectDesc": "Custom scrollbar styling improving overall aesthetics.",
    "techStack": ["css"],
    "difficulty": "beginner",
    "projectPath": "./public/Custom Scroll Bar/index.html"
  },
  {
    "projectNo": 17,
    "projectName": "Slider Using Swiper API",
    "projectType": "UI",
    "projectDesc": "Interactive content slider built with Swiper integration.",
    "techStack": ["api", "javascript"],
    "difficulty": "intermediate",
    "projectPath": "./public/slider%20box/index.html"
  },
  {
    "projectNo": 18,
    "projectName": "Carousel Solar System",
    "projectType": "Animation",
    "projectDesc": "Solar system themed rotating carousel with visual motion effects.",
    "techStack": ["css", "canvas"],
    "difficulty": "intermediate",
    "projectPath": "./public/Carousel%20Solar%20System/index.html"
  },
  {
    "projectNo": 19,
    "projectName": "Planto",
    "projectType": "Website",
    "projectDesc": "Nature-inspired landing page emphasizing clean layouts and styling.",
    "techStack": ["css"],
    "difficulty": "beginner",
    "projectPath": "./public/plantwebsite/plant.html"
  },
  {
    "projectNo": 20,
    "projectName": "EveSparks",
    "projectType": "Website",
    "projectDesc": "Interactive web experience featuring modern interface components.",
    "techStack": ["javascript"],
    "difficulty": "intermediate",
    "projectPath": "https://evesparks.onrender.com/"
  },
  {
    "projectNo": 21,
    "projectName": "Video BG Slider Using React",
    "projectType": "Website",
    "projectDesc": "React-based slider with dynamic video backgrounds.",
    "techStack": ["javascript"],
    "difficulty": "intermediate",
    "projectPath": "./public/travel_website/index.html"
  },
  {
    "projectNo": 22,
    "projectName": "Page Loader",
    "projectType": "UI",
    "projectDesc": "Animated loading screen improving perceived performance.",
    "techStack": ["ui", "css"],
    "difficulty": "beginner",
    "projectPath": "./public/pageloader/pageloader.html"
  },
  {
    "projectNo": 23,
    "projectName": "Jarvis Virtual Assistant",
    "projectType": "AI",
    "projectDesc": "Voice-enabled assistant inspired by AI interactions.",
    "techStack": ["api", "javascript"],
    "difficulty": "intermediate",
    "projectPath": "./public/Jarvis-AI-main/index.html"
  },
  {
    "projectNo": 24,
    "projectName": "Chat Bot",
    "projectType": "AI",
    "projectDesc": "Conversational chatbot interface supporting user interactions.",
    "techStack": ["api", "javascript"],
    "difficulty": "intermediate",
    "projectPath": "./public/AI ChatBot/chatbot.html"
  },
  {
    "projectNo": 25,
    "projectName": "Tic-Tac-Toe",
    "projectType": "Game",
    "projectDesc": "Classic two-player game built with JavaScript logic.",
    "techStack": ["game", "javascript"],
    "difficulty": "beginner",
    "projectPath": "./public/TicTacToe/index.html"
  },
  {
    "projectNo": 26,
    "projectName": "Maze Game",
    "projectType": "Game",
    "projectDesc": "Navigate through a maze while avoiding obstacles.",
    "techStack": ["game", "javascript"],
    "difficulty": "intermediate",
    "projectPath": "./public/Maze-Game-main/index.html"
  },
  {
    "projectNo": 27,
    "projectName": "Memory Game",
    "projectType": "Game",
    "projectDesc": "Card matching challenge testing short-term memory skills.",
    "techStack": ["game", "javascript"],
    "difficulty": "beginner",
    "projectPath": "./public/MemoryGame/index.html"
  },
  {
    "projectNo": 28,
    "projectName": "Wordle",
    "projectType": "Game",
    "projectDesc": "Word guessing game inspired by the popular puzzle format.",
    "techStack": ["game", "javascript"],
    "difficulty": "intermediate",
    "projectPath": "./public/WORDLE/index.html"
  },
  {
    "projectNo": 29,
    "projectName": "Snake Game",
    "projectType": "Game",
    "projectDesc": "Classic snake gameplay with score tracking mechanics.",
    "techStack": ["game", "javascript"],
    "difficulty": "beginner",
    "projectPath": "./public/snake_game/index.html"
  },
  {
    "projectNo": 30,
    "projectName": "Flappy-bird-game",
    "projectType": "Game",
    "projectDesc": "Obstacle avoidance game inspired by Flappy Bird.",
    "techStack": ["game", "canvas"],
    "difficulty": "intermediate",
    "projectPath": "./public/Flappy-bird-main/index.html"
  },
  {
    "projectNo": 31,
    "projectName": "Password Manager",
    "projectType": "Tool",
    "projectDesc": "Secure utility for storing and organizing passwords efficiently.",
    "techStack": ["tool", "javascript"],
    "difficulty": "intermediate",
    "projectPath": "./public/password%20manager/index.html"
  },
  {
    "projectNo": 32,
    "projectName": "Missionaries & Cannibals",
    "projectType": "Game",
    "projectDesc": "Logic puzzle based on the classic river crossing challenge.",
    "techStack": ["game", "javascript"],
    "difficulty": "intermediate",
    "projectPath": "./public/Missionaries&Cannibals/index.html"
  },
  {
    "projectNo": 33,